{
  "state": "MA",
  "program": "SNAP",
  "program_aliases": [
    "Supplemental Nutrition Assistance Program",
    "SNAP",
    "food stamps",
    "food assistance"
  ],
  "administering_agency": {
    "name": "Massachusetts Department of Transitional Assistance",
    "abbreviation": "DTA"
  },
  "sub_agency": null,
  "records_officer": {
    "name": "Lauren Picone",
    "title": "Records Access Officer",
    "org_title": "Deputy General Counsel"
  },
  "contact": {
    "email": "DTA.RAO@state.ma.us",
    "phone": "6173485247",
    "address_line1": "One Ashburton Place",
    "address_line2": null,
    "city": "Boston",
    "state": "MA",
    "zip": "02108"
  },
  "portal": {
    "name": "DTA Public Records Request Form",
    "url": "https://www.mass.gov/forms/submit-a-department-of-transitional-assistance-dta-public-records-request-prr",
    "required_fields": [
      "description_or_summary_of_request",
      "first_and_last_name",
      "name_of_organization",
      "requestor_email"
    ]
  },
  "submission_methods": ["email", "mail", "portal", "fax", "in_person"],
  "known_system_names": ["BEACON", "EPPIC", "DTA Connect"],
  "known_vendors": ["Fidelity Information Services (FIS)", "Conduent"],
  "benefits_tech_systems": [
    {
      "vendor_name": "Thomson Reuters Enterprise Centre GmbH / West Publishing Corporation",
      "product_names": [
        "CLEAR",
        "CLEAR ProFlex",
        "CLEAR Government Investigations Advanced",
        "Batch Person Search (4,800 annual inputs)"
      ],
      "use_cases": [
        "Data lookup tool for fraud detection and identity verification (general-purpose investigative platform)"
      ],
      "programs_covered": ["SNAP", "TAFDC", "EAEDC"],
      "contract_or_order_ids": ["Q-08237974", "Account #1000355212"],
      "pricing_terms": "CLEAR ProFlex monthly charge $3,424.17; minimum term 36 months; automatic 12-month renewal absent 30-day notice.",
      "user_seats": null,
      "batch_or_match_limits": "Batch Person Search subscription includes 4,800 annual inputs; overages charged at Schedule A rates.",
      "required_data_inputs": [],
      "named_deliverables": [],
      "hosting_security_retention": null,
      "evidence": [
        {
          "field": "product_names",
          "source_type": "production_doc",
          "source_ref": "gold_letter.pdf",
          "production_package_id": "MA_DTA_ADS_2026",
          "document_title": "Thomson Reuters Order Form Q-08237974",
          "page": 3,
          "quote": "ProFlex Products / 41308780 / CLEAR Proflex / $3,424.17 / 36 (Months)",
          "received_at": "2026-02-13"
        },
        {
          "field": "pricing_terms",
          "source_type": "production_doc",
          "source_ref": "gold_letter.pdf",
          "production_package_id": "MA_DTA_ADS_2026",
          "document_title": "Thomson Reuters Order Form Q-08237974, Attachment",
          "page": 6,
          "quote": "41308780 CLEAR Proflex ... $3,424.17",
          "received_at": "2026-02-13"
        },
        {
          "field": "batch_or_match_limits",
          "source_type": "production_doc",
          "source_ref": "gold_letter.pdf",
          "production_package_id": "MA_DTA_ADS_2026",
          "document_title": "Thomson Reuters Order Form Q-08237974, Attachment",
          "page": 6,
          "quote": "42028395 BATCH PERSON SEARCH 4800 ANNUAL INPUTS",
          "received_at": "2026-02-13"
        }
      ]
    },
    {
      "vendor_name": "West Publishing Corporation (a Thomson Reuters business)",
      "product_names": ["ID Risk Analytics (IDRA)", "CLEAR ID Confirm"],
      "use_cases": [
        "Identity-risk analytics over SNAP recipient population (heads of household) for fraud/identity-verification flagging",
        "Aggregate risk dashboards displaying applicants binned high/medium/low risk",
        "Configured anomaly alerts (shared home address, IP address, email address, deceased recipients)"
      ],
      "programs_covered": ["SNAP"],
      "contract_or_order_ids": ["West Publishing SOW for IDRA (companion to Order Q-08237974)"],
      "pricing_terms": "Year 1 total $327,180: IDRA Subscription (up to 30 users, incl. CLEAR ID Confirm for up to 500,000 program participants/year) $214,980; one-time batch of ID Risk Analytics for current population (~1.02M recipients) with SIU Briefing Report and supporting identity-risk details $112,200. Years 2 and 3 annual subscription increases 5% year over year. Additional recipients above the threshold: $0.20/recipient.",
      "user_seats": 30,
      "batch_or_match_limits": "One-time batch of CIDC data: up to 1,020,000 recipients (then-current SNAP population). Ongoing Recipient Validation: up to 500,000 matches per year. Risk Alerts: up to 30 configured alerts.",
      "required_data_inputs": [
        "One year of program data relating to applicants, recipients, and households (delivered within 30 days of contract start)",
        "Reference descriptions for all reference codes in the data",
        "Data dictionaries for all the data delivered to TR",
        "Diagram of the relational model (primary/foreign key relations among source tables)"
      ],
      "named_deliverables": [
        "Data Files Specification Document (DFSD)",
        "One-time batch ID Risk Analytics output for current existing SNAP population, plus a Summary Briefing Report (Special Investigations Unit) with supporting identity-risk details and a review session",
        "Master Design Document (MDD) from Project Requirements and Onboarding Process (PROP) sessions",
        "Training (one remote session per 20 users, up to 4 remote sessions; screen-specific customized user manuals)",
        "Online User Manual for the System"
      ],
      "hosting_security_retention": "Hosting: Microsoft Azure platform and data centers, with industry-standard security protocols and ciphers. Connectivity via secure VPN from Customer's network. Backup: nightly encrypted file- and database-level backups via Azure Recovery Services Vault; AES-256 storage area network (SAN) at rest. Customer-defined data retention policy (provided within 45 days of contract start); default if absent is 30 days post-termination destruction. Security incident reporting to ISO@PonderaSolutions.com within 72 hours of unauthorized use/disclosure.",
      "evidence": [
        {
          "field": "product_names",
          "source_type": "production_doc",
          "source_ref": "gold_letter.pdf",
          "production_package_id": "MA_DTA_ADS_2026",
          "document_title": "West Publishing Corporation Statement of Work",
          "page": 7,
          "quote": "West Publishing Corporation, a Thomson Reuters business ... will deliver to the Massachusetts Department of Transitional Assistance (Customer) its identity risk analytics (ID Risk Analytics or IDRA) solution",
          "received_at": "2026-02-13"
        },
        {
          "field": "user_seats",
          "source_type": "production_doc",
          "source_ref": "gold_letter.pdf",
          "production_package_id": "MA_DTA_ADS_2026",
          "document_title": "West Publishing Corporation Statement of Work",
          "page": 7,
          "quote": "deployed in Microsoft's Azure environment for up to 30 users",
          "received_at": "2026-02-13"
        },
        {
          "field": "programs_covered",
          "source_type": "production_doc",
          "source_ref": "gold_letter.pdf",
          "production_package_id": "MA_DTA_ADS_2026",
          "document_title": "West Publishing Corporation Statement of Work",
          "page": 9,
          "quote": "TR will run current heads of household through ID Risk Analytics to identify areas of risk",
          "received_at": "2026-02-13"
        },
        {
          "field": "batch_or_match_limits",
          "source_type": "production_doc",
          "source_ref": "gold_letter.pdf",
          "production_package_id": "MA_DTA_ADS_2026",
          "document_title": "West Publishing Corporation Statement of Work",
          "page": 10,
          "quote": "IDRA Subscription - Up to 30 Users, including CLEAR ID Confirm for up to 500,000 program participants per year",
          "received_at": "2026-02-13"
        },
        {
          "field": "pricing_terms",
          "source_type": "production_doc",
          "source_ref": "gold_letter.pdf",
          "production_package_id": "MA_DTA_ADS_2026",
          "document_title": "West Publishing Corporation Statement of Work",
          "page": 10,
          "quote": "Year 1 Total $327,180 ... The annual subscription for Years 2 and 3 will increase by 5% year over year. ... Additional recipients above the threshold will be charged at $.20/recipient.",
          "received_at": "2026-02-13"
        },
        {
          "field": "required_data_inputs",
          "source_type": "production_doc",
          "source_ref": "gold_letter.pdf",
          "production_package_id": "MA_DTA_ADS_2026",
          "document_title": "West Publishing Corporation Statement of Work",
          "page": 11,
          "quote": "Within thirty (30) days of contract start, Customer will provide TR with one (1) year of program data relating to applicants, recipients, and households ... Customer will provide reference descriptions for all reference codes in the data and data dictionaries for all the data delivered to TR. ... Customer will provide a diagram of the relational model",
          "received_at": "2026-02-13"
        },
        {
          "field": "hosting_security_retention",
          "source_type": "production_doc",
          "source_ref": "gold_letter.pdf",
          "production_package_id": "MA_DTA_ADS_2026",
          "document_title": "West Publishing Corporation Statement of Work",
          "page": 9,
          "quote": "The storage system housing backup snapshots is an AES 256-bit Storage Access Network (SAN) storage device encrypted at rest",